{
  "schema_version": "0.5",
  "registry_id": "registry_p0_v0_1",
  "description": "Initial analyzer-local P0 Rule Engine registry for deterministic vertical slice.",
  "rules": [
    {
      "criterion_id": "PATH-CTA-001",
      "axis": "Path",
      "applicableStages": ["FIRST_VIEW", "CTA"],
      "evidence_level": "Operational",
      "definition": "Selected scenario should expose a goal-relevant primary-like CTA in FIRST_VIEW or CTA stage.",
      "required_observations": ["cta_candidate", "scenario_goal", "page_type", "first_view_bounds"],
      "measurement_sources": ["dom", "layout", "screenshot", "ax"],
      "signal_rule": "No primary-like CTA candidate is available in the stage context after deterministic signal extraction.",
      "severity_rules": [
        {"severity": 0, "condition": "primary-like CTA exists"},
        {"severity": 1, "condition": "only weak CTA candidates exist"},
        {"severity": 2, "condition": "no goal-relevant primary-like CTA in CTA stage"},
        {"severity": 3, "condition": "entrypoint disabled, blocked, or unreachable"}
      ],
      "confidence_rule": "High when DOM, AX, layout, and screenshot align; cap when semantic/provider confidence is low or visual-only evidence is present.",
      "fix_leverage_default": 1.0,
      "output_template": "핵심 행동을 시작할 primary CTA가 충분히 드러나지 않아 다음 행동 선택이 어려울 수 있습니다.",
      "source_refs": ["docs/05_judge_scoring_validation.md#9-path-cta-001-상세"]
    },
    {
      "criterion_id": "PATH-CTA-002",
      "axis": "Path",
      "applicableStages": ["CTA"],
      "evidence_level": "Operational",
      "definition": "Primary-like CTAs should not excessively compete inside the same decision context.",
      "required_observations": ["cta_candidate", "cta_cluster", "visual_emphasis"],
      "measurement_sources": ["dom", "layout", "screenshot"],
      "signal_rule": "primary_like_cta_count >= 3 in the CTA decision context.",
      "severity_rules": [
        {"severity": 0, "condition": "primary-like CTA count is 0-2"},
        {"severity": 2, "condition": "primary-like CTA count is 3 or more"}
      ],
      "confidence_rule": "Use cluster observation confidence when present; otherwise use aggregate-signal medium confidence.",
      "fix_leverage_default": 1.0,
      "output_template": "같은 결정 순간에서 여러 primary급 CTA가 경쟁해 사용자가 첫 행동을 고르기 어려울 수 있습니다.",
      "source_refs": ["docs/05_judge_scoring_validation.md#11-나머지-p0-rule-최소-정책"]
    },
    {
      "criterion_id": "PATH-CHOICE-OVERLOAD-001",
      "axis": "Path",
      "applicableStages": ["FIRST_VIEW", "VALUE", "CTA"],
      "evidence_level": "Operational",
      "definition": "A viewport should not expose an excessive number of simultaneous interactive choices.",
      "required_observations": ["interactive_components"],
      "measurement_sources": ["dom", "layout"],
      "signal_rule": "Count visible, enabled, clickable interactive components intersecting the viewport.",
      "severity_rules": [
        {"severity": 0, "condition": "interactive choice count is 10 or fewer"},
        {"severity": 1, "condition": "interactive choice count is 11 or more"},
        {"severity": 2, "condition": "interactive choice count is 15 or more"},
        {"severity": 3, "condition": "interactive choice count is 20 or more in a high-impact action stage"}
      ],
      "confidence_rule": "Use observation confidence and cap confidence when viewport dimensions are missing.",
      "fix_leverage_default": 1.0,
      "output_template": "Too many interactive choices are visible at once.",
      "source_refs": ["docs/12_analyzer_rule_catalog.md#path-choice-overload-001", "docs/13_analyzer_rule_required_data.md#path-choice-overload-001"]
    },
    {
      "criterion_id": "FRICTION-FORM-001",
      "axis": "Friction",
      "applicableStages": ["INPUT"],
      "evidence_level": "Standard",
      "definition": "Visible input fields should provide a label, accessible name, or equivalent instruction.",
      "required_observations": ["form_field", "instruction_text"],
      "measurement_sources": ["dom", "ax", "screenshot"],
      "signal_rule": "A visible form field has neither clear label/instruction nor accessible name when label relation evidence is available.",
      "severity_rules": [
        {"severity": 0, "condition": "visible label or accessible name is clear"},
        {"severity": 1, "condition": "placeholder-only label support"},
        {"severity": 2, "condition": "visible field has no label or accessible name"}
      ],
      "confidence_rule": "Cap confidence if AX or label relation evidence is absent.",
      "fix_leverage_default": 1.0,
      "output_template": "입력 필드의 목적을 알려주는 label 또는 instruction이 부족해 입력 진행이 어려울 수 있습니다.",
      "source_refs": ["docs/05_judge_scoring_validation.md#10-friction-form-001-상세"]
    },
    {
      "criterion_id": "COPY-FLOW-QUALITY-001",
      "axis": "Clarity",
      "applicableStages": ["FIRST_VIEW", "VALUE", "CTA", "INPUT", "COMMIT"],
      "evidence_level": "Standard",
      "definition": "Visible labels should match the UI element role, function, or surrounding context.",
      "required_observations": ["label_role_alignment", "screenshot"],
      "measurement_sources": ["screenshot", "dom", "layout", "ax"],
      "signal_rule": "A GMS label-role alignment result marks a candidate as status=mismatch with sufficient confidence.",
      "severity_rules": [
        {"severity": 0, "condition": "label_role_alignment is aligned or unavailable"},
        {"severity": 1, "condition": "GMS reports a low-impact label-role mismatch"},
        {"severity": 2, "condition": "GMS reports a mismatch on a primary, clicked, or high-leverage element"},
        {"severity": 3, "condition": "GMS reports a high-leverage mismatch on a commit-stage action"}
      ],
      "confidence_rule": "Use sanitized GMS label-role confidence only; deterministic observation type or direct label_issue_type fields do not emit this rule.",
      "fix_leverage_default": 1.0,
      "output_template": "A visible label does not match the element role or expected next action.",
      "source_refs": ["docs/12_analyzer_rule_catalog.md#copy-flow-quality-001"]
    },
    {
      "criterion_id": "COPY-LABEL-INTEGRITY-001",
      "axis": "Clarity",
      "applicableStages": ["FIRST_VIEW", "VALUE", "CTA", "INPUT", "COMMIT"],
      "evidence_level": "Standard",
      "definition": "Visible labels and short copy should be readable without broken, clipped, overlapped, or truncated rendering.",
      "required_observations": ["label_integrity", "screenshot"],
      "measurement_sources": ["screenshot", "dom", "layout", "ax"],
      "signal_rule": "A deterministic or GMS label_integrity result marks a candidate as status=issue with an allowed integrity issue type.",
      "severity_rules": [
        {"severity": 0, "condition": "label_integrity is ok or unavailable"},
        {"severity": 1, "condition": "low-impact readability issue"},
        {"severity": 2, "condition": "broken, clipped, overlapped, or path-related label issue"},
        {"severity": 3, "condition": "commit-stage high-leverage integrity issue"}
      ],
      "confidence_rule": "Use sanitized label_integrity confidence when present; deterministic text corruption signals may also emit.",
      "fix_leverage_default": 1.0,
      "output_template": "A visible label or short copy is difficult to read.",
      "source_refs": ["docs/12_analyzer_rule_catalog.md#copy-label-integrity-001"]
    },
    {
      "criterion_id": "RELIABILITY-TECH-001",
      "axis": "Reliability",
      "applicableStages": ["CTA", "INPUT", "COMMIT"],
      "evidence_level": "Technical",
      "definition": "Failed requests or console/page errors immediately after user actions should be surfaced as reliability risk.",
      "required_observations": ["network_failure", "console_error"],
      "measurement_sources": ["network", "console", "scenario_log"],
      "signal_rule": "failed request count or console error count is greater than zero in stage-attributed action context evidence.",
      "severity_rules": [
        {"severity": 0, "condition": "no failed request or console error evidence"},
        {"severity": 2, "condition": "one or more failed requests or console errors after action"}
      ],
      "confidence_rule": "High for direct network/console observations or checkpoint-local state summaries. Run-level aggregate-only counters are diagnostic and do not emit staged issues.",
      "fix_leverage_default": 1.0,
      "output_template": "사용자 행동 직후 기술 오류가 관찰되어 진행 신뢰성이 낮아질 수 있습니다.",
      "source_refs": ["docs/05_judge_scoring_validation.md#11-나머지-p0-rule-최소-정책"]
    },
    {
      "criterion_id": "RELIABILITY-LOADING-STUCK-001",
      "axis": "Reliability",
      "applicableStages": ["CTA", "INPUT", "COMMIT"],
      "evidence_level": "Operational",
      "definition": "A normal navigation action should render the next page or result view into a usable state within the expected ready threshold.",
      "required_observations": ["page_ready_timing", "loading_state", "settle_response"],
      "measurement_sources": ["performance", "dom", "layout", "scenario_log"],
      "signal_rule": "A general navigation action has duration_ms >= 5000 when all configured target_page_signals are false.",
      "severity_rules": [
        {"severity": 0, "condition": "normal navigation becomes usable under 5000ms, or one configured target_page_signals flag is true"},
        {"severity": 2, "condition": "normal navigation page ready duration is 5000ms or more"},
        {"severity": 3, "condition": "normal navigation page ready duration is 8000ms or more, or a commit-stage navigation is delayed"}
      ],
      "exceptions": [
        "Suppress when the action is not a normal navigation/link/menu/tab transition.",
        "Suppress when target_page_signals has has_permission_prompt, has_streaming_response, has_map, has_payment_form, has_auth_redirect, or has_webgl set to true.",